20:31:42.687037 IP 192.168.1.28.5900 > 192.168.1.25.55531: Flags [.], seq 3905337011:3905338471, ack 181367470, win 62176, length 1460
20:31:42.687100 IP 192.168.1.28.5900 > 192.168.1.25.55531: Flags [.], seq 1460:2920, ack 1, win 62176, length 1460
20:31:42.690611 IP 192.168.1.28.5900 > 192.168.1.25.55531: Flags [.], seq 2920:4380, ack 1, win 62176, length 1460
20:31:42.690640 IP 192.168.1.28.5900 > 192.168.1.25.55531: Flags [.], seq 4380:5840, ack 1, win 62176, length 1460
20:31:42.690952 IP 192.168.1.28.5900 > 192.168.1.25.55531: Flags [.], seq 5840:7300, ack 1, win 62176, length 1460
