20:34:02.439087 IP 192.168.1.28.5900 > 192.168.1.25.55531: Flags [.], seq 3906502119:3906503579, ack 181377604, win 62176, length 1460
20:34:02.439103 IP 192.168.1.28.5900 > 192.168.1.25.55531: Flags [.], seq 1460:2920, ack 1, win 62176, length 1460
20:34:02.439257 IP 192.168.1.25.55531 > 192.168.1.28.5900: Flags [.], ack 4294943936, win 64240, length 0
20:34:02.439298 IP 192.168.1.28.5900 > 192.168.1.25.55531: Flags [.], seq 2920:4380, ack 1, win 62176, length 1460
20:34:02.439395 IP 192.168.1.25.55531 > 192.168.1.28.5900: Flags [.], ack 4294946856, win 64240, length 0
20:34:02.439504 IP 192.168.1.25.55531 > 192.168.1.28.5900: Flags [.], ack 4294949776, win 64240, length 0
20:34:02.439610 IP 192.168.1.25.55531 > 192.168.1.28.5900: Flags [.], ack 4294954156, win 64240, length 0
20:34:02.440051 IP 192.168.1.28.5900 > 192.168.1.25.55531: Flags [.], seq 4380:5840, ack 1, win 62176, length 1460
20:34:02.440066 IP 192.168.1.28.5900 > 192.168.1.25.55531: Flags [P.], seq 5840:6696, ack 1, win 62176, length 856
20:34:02.442753 IP 192.168.1.25.55531 > 192.168.1.28.5900: Flags [.], ack 4294955616, win 64240, length 0
20:34:02.443111 IP 192.168.1.25.55531 > 192.168.1.28.5900: Flags [.], ack 4294958536, win 64240, length 0
20:34:02.443312 IP 192.168.1.25.55531 > 192.168.1.28.5900: Flags [.], ack 4294962916, win 64240, length 0
20:34:02.443426 IP 192.168.1.25.55531 > 192.168.1.28.5900: Flags [.], ack 4294964376, win 64240, length 0
20:34:02.468868 IP 192.168.1.28.5900 > 192.168.1.25.55531: Flags [P.], seq 5840:6696, ack 1, win 62176, length 856
20:34:02.473795 IP 192.168.1.25.55531 > 192.168.1.28.5900: Flags [.], ack 6696, win 64240, options [nop,nop,sack 1 {5840:6696}], length 0
20:34:02.475597 IP 192.168.1.25.55531 > 192.168.1.28.5900: Flags [P.], seq 1:11, ack 6696, win 64240, length 10
20:34:02.475644 IP 192.168.1.28.5900 > 192.168.1.25.55531: Flags [.], ack 11, win 62176, length 0
20:34:02.678661 IP 192.168.1.28.5900 > 192.168.1.25.55531: Flags [.], seq 6696:8156, ack 11, win 62176, length 1460
20:34:02.678879 IP 192.168.1.28.5900 > 192.168.1.25.55531: Flags [.], seq 8156:9616, ack 11, win 62176, length 1460
20:34:02.678916 IP 192.168.1.28.5900 > 192.168.1.25.55531: Flags [.], seq 9616:11076, ack 11, win 62176, length 1460
